{
  "schemaVersion": "4.5.0",
  "waVersion": "2.3000.1052559453",
  "dispatcherModules": [
    "WAWebCommsHandleLoggedInStanza",
    "WAWebCommsHandleWorkerCompatibleStanza"
  ],
  "stanzaTags": [
    {
      "tag": "call",
      "handlerModule": "WAWebHandleVoipCall",
      "handlerFunction": "handleCall"
    },
    {
      "tag": "chatstate"
    },
    {
      "tag": "error",
      "handlerModule": "WABackendHandleError",
      "handlerFunction": "handleError"
    },
    {
      "tag": "failure",
      "handlerModule": "WAWebHandleFailure"
    },
    {
      "tag": "ib",
      "handlerModule": "WAWebHandleInfoBulletin"
    },
    {
      "tag": "message"
    },
    {
      "tag": "notification"
    },
    {
      "tag": "presence",
      "handlerModule": "WAWebHandlePresence"
    },
    {
      "tag": "receipt"
    },
    {
      "tag": "status"
    },
    {
      "tag": "stream:error",
      "handlerModule": "WAWebHandleStreamError"
    },
    {
      "tag": "success",
      "handlerModule": "WAWebHandleSuccess"
    },
    {
      "tag": "xmlstreamend"
    }
  ],
  "notifications": [
    {
      "type": "account_sync",
      "handlerModule": "WAWebHandleAccountSyncNotification",
      "handlerFunction": "handleAccountSyncNotification",
      "content": {
        "parserName": "incomingAccountSyncNotification",
        "assertions": [
          {
            "kind": "tag",
            "name": "notification"
          }
        ],
        "fields": [
          {
            "method": "attrString",
            "name": "id",
            "type": "string",
            "parserRequired": true
          },
          {
            "method": "attrTime",
            "name": "t",
            "type": "integer",
            "parserRequired": true
          },
          {
            "method": "attrDeviceJid",
            "name": "from",
            "type": "device_jid",
            "parserRequired": true
          },
          {
            "method": "child",
            "name": "status",
            "type": "string",
            "parserRequired": false,
            "tag": "status",
            "children": [
              {
                "method": "attrString",
                "name": "action",
                "type": "string",
                "parserRequired": false
              }
            ]
          },
          {
            "method": "child",
            "name": "text_status",
            "type": "string",
            "parserRequired": false,
            "tag": "text_status",
            "children": [
              {
                "method": "attrString",
                "name": "action",
                "type": "string",
                "parserRequired": false
              },
              {
                "method": "attrString",
                "name": "text",
                "type": "string",
                "parserRequired": false
              },
              {
                "method": "attrInt",
                "name": "ephemeral_duration_sec",
                "type": "integer",
                "parserRequired": false
              },
              {
                "method": "attrString",
                "name": "last_update_time",
                "type": "string",
                "parserRequired": false
              }
            ]
          },
          {
            "method": "child",
            "name": "devices",
            "type": "string",
            "parserRequired": false,
            "tag": "devices",
            "children": []
          },
          {
            "method": "child",
            "name": "blocklist",
            "type": "string",
            "parserRequired": false,
            "tag": "blocklist",
            "children": [
              {
                "method": "forEachChildWithTag",
                "name": "item",
                "type": "string",
                "parserRequired": true,
                "tag": "item",
                "children": [
                  {
                    "method": "maybeAttrString",
                    "name": "username",
                    "type": "string",
                    "parserRequired": false
                  },
                  {
                    "method": "attrUserJid",
                    "name": "jid",
                    "type": "user_jid",
                    "parserRequired": true
                  }
                ],
                "repeats": true
              }
            ]
          },
          {
            "method": "child",
            "name": "tos",
            "type": "string",
            "parserRequired": false,
            "tag": "tos",
            "children": [
              {
                "method": "forEachChildWithTag",
                "name": "notice",
                "type": "string",
                "parserRequired": true,
                "tag": "notice",
                "children": [
                  {
                    "method": "maybeAttrString",
                    "name": "state",
                    "type": "string",
                    "parserRequired": false
                  },
                  {
                    "method": "attrString",
                    "name": "id",
                    "type": "string",
                    "parserRequired": true
                  }
                ],
                "repeats": true
              }
            ]
          },
          {
            "method": "child",
            "name": "disappearing_mode",
            "type": "string",
            "parserRequired": false,
            "tag": "disappearing_mode",
            "children": [
              {
                "method": "attrString",
                "name": "action",
                "type": "string",
                "parserRequired": false
              },
              {
                "method": "attrInt",
                "name": "duration",
                "type": "integer",
                "parserRequired": true
              },
              {
                "method": "attrInt",
                "name": "t",
                "type": "integer",
                "parserRequired": true
              }
            ]
          },
          {
            "method": "child",
            "name": "notice",
            "type": "string",
            "parserRequired": false,
            "tag": "notice",
            "children": [
              {
                "method": "attrString",
                "name": "id",
                "type": "string",
                "parserRequired": true
              },
              {
                "method": "maybeAttrString",
                "name": "stage",
                "type": "string",
                "parserRequired": false
              },
              {
                "method": "maybeAttrString",
                "name": "version",
                "type": "string",
                "parserRequired": false
              },
              {
                "method": "attrInt",
                "name": "t",
                "type": "integer",
                "parserRequired": true
              }
            ]
          },
          {
            "method": "child",
            "name": "user",
            "type": "string",
            "parserRequired": false,
            "tag": "user",
            "children": [
              {
                "method": "maybeAttrString",
                "name": "state",
                "type": "string",
                "parserRequired": false
              }
            ]
          },
          {
            "method": "child",
            "name": "biz_opt_out_list",
            "type": "string",
            "parserRequired": false,
            "tag": "biz_opt_out_list",
            "children": [
              {
                "method": "mapChildren",
                "name": "children",
                "type": "string",
                "parserRequired": true,
                "children": [
                  {
                    "method": "attrString",
                    "name": "action",
                    "type": "string",
                    "parserRequired": true
                  },
                  {
                    "method": "attrUserJid",
                    "name": "biz_jid",
                    "type": "user_jid",
                    "parserRequired": true
                  }
                ],
                "repeats": true
              },
              {
                "method": "maybeAttrString",
                "name": "dhash",
                "type": "string",
                "parserRequired": false
              },
              {
                "method": "maybeAttrString",
                "name": "prev_dhash",
                "type": "string",
                "parserRequired": false
              }
            ]
          }
        ]
      }
    },
    {
      "type": "biz_thread_data",
      "content": {
        "parserName": "parseNotifyRequest",
        "assertions": [
          {
            "kind": "tag",
            "name": "notification"
          },
          {
            "kind": "attr",
            "name": "from",
            "value": "s.whatsapp.net"
          },
          {
            "kind": "attr",
            "name": "type",
            "value": "biz_thread_data"
          }
        ],
        "fields": [
          {
            "method": "attrDomainJid",
            "name": "from",
            "wireName": "from",
            "type": "jid",
            "parserRequired": true,
            "literalValue": "s.whatsapp.net"
          },
          {
            "method": "attrString",
            "name": "type",
            "wireName": "type",
            "type": "string",
            "parserRequired": true,
            "literalValue": "biz_thread_data"
          },
          {
            "method": "attrLidUserJid",
            "name": "threadDataThreadLid",
            "wireName": "thread_lid",
            "type": "lid_user_jid",
            "parserRequired": true,